{
  "schemaVersion": 1,
  "id": "H26",
  "description": "普通缺陷修复：公开合成 fixture，检查入口只读",
  "files": [
    {
      "path": "src/range.js",
      "content": "export function range(start,end){return Array.from({length:Math.max(0,end-start)},(_,i)=>start+i)}\n"
    },
    {
      "path": "REQUEST.md",
      "content": "range(2,2) should be [2] and range(1,3) should include 3. The provided repro test exposes the bug.\n"
    },
    {
      "path": "package.json",
      "content": "{\"type\": \"module\", \"scripts\": {\"repro\": \"node test/repro.test.mjs\"}}\n"
    },
    {
      "path": "test/repro.test.mjs",
      "content": "import assert from 'node:assert/strict';import {range} from '../src/range.js';\nassert.deepEqual(range(2,2),[2]);assert.deepEqual(range(1,3),[1,2,3]);\n"
    }
  ],
  "oracleFiles": [
    {
      "path": "check.mjs",
      "content": "import assert from 'node:assert/strict';import {pathToFileURL} from 'node:url';const {range}=await import(pathToFileURL(process.cwd()+'/src/range.js'));\nassert.deepEqual(range(2,2),[2]);assert.deepEqual(range(1,3),[1,2,3]);\n"
    }
  ],
  "git": {
    "initialize": true
  },
  "faults": [],
  "hiddenChecks": [
    {
      "id": "H26-oracle",
      "program": "node",
      "args": [
        "{ORACLE_DIR}/check.mjs"
      ],
      "expectedExitCode": 0
    }
  ]
}
