{
  "schemaVersion": 1,
  "id": "H18",
  "description": "Worktree conflict fixture",
  "files": [
    {
      "path": "src/serializer.js",
      "content": "export function serialize(value){return JSON.stringify(value)}\\n"
    },
    {
      "path": "test/serializer.test.js",
      "content": "// compatibility test retained by fixture\\n"
    },
    {
      "path": "package.json",
      "content": "{\"type\":\"module\"}\\n"
    }
  ],
  "oracleFiles": [
    {
      "path": "check.mjs",
      "content": "import assert from 'node:assert/strict';import {pathToFileURL} from 'node:url';const s=await import(pathToFileURL(process.cwd()+'/src/serializer.js'));assert.equal(s.serialize({b:2,a:1}),'{\"a\":1,\"b\":2}');assert.deepEqual(s.deserialize('{\"a\":1}'),{a:1});\\n"
    }
  ],
  "git": {
    "initialize": true,
    "worktrees": [
      "serializer-impl",
      "serializer-compat"
    ]
  },
  "faults": [],
  "hiddenChecks": [
    {
      "id": "H18-oracle",
      "program": "node",
      "args": [
        "{ORACLE_DIR}/check.mjs"
      ],
      "expectedExitCode": 0
    }
  ]
}
